angle,primary_pain,mechanism,proof_visual,cta,example_hook,platform_fit
No motivacion,Empieza y abandona,Estructura diaria,Checklist Dia 1,Comenta CONTROL,No te falta motivacion. Te falta estructura.,Reels/TikTok
Vivir reaccionando,Vive apagando incendios,Volver al marco,Antes/Despues mental,Comenta CONTROL,La mayoria no vive. Reacciona.,Reels/TikTok
Dia 1,Piensa demasiado grande,Siguiente accion,Contador Dia 1/100,Comenta DIA1,No pienses en 100 dias. Piensa en Dia 1.,Reels/TikTok
Dia 7,No sostiene procesos,Medicion real,Barra Dia 0 -> Dia 7,Comenta DIA7,El KPI real no es motivacion. Es Dia 7.,Reels/TikTok
Volver,Usa el fallo como excusa,Regla de regreso,Loop Fallo -> Vuelvo,Comenta VOLVER,Fallar no destruye el Metodo. No volver si.,Reels/TikTok
Alpha limitado,Duda antes de entrar,Prueba de 14 dias,Cupos 10 / USD 9,Reserva Alpha,10 cupos. 14 dias. Una prueba real.,Instagram/Facebook
Facturar con estructura,Quiere ingresos pero improvisa,Ejecucion diaria,Ruta accion diaria,Comenta CONTROL,Si quieres facturar deja de improvisar.,Reels/Facebook
No teoria infinita,Consume pero no ejecuta,Una accion diaria,Menos contenido / Mas ejecucion,Comenta DIA1,Guardar contenido no es avanzar.,Instagram
